{"already_satisfied_count":5,"backend_only_evidence_count":232,"bottleneck_by_lifecycle_stage":[{"count":76,"key":"blocked"},{"count":213,"key":"requires-upstream-validation"}],"candidate_aging":[{"count":39,"key":"0-14-days"},{"count":21,"key":"15-60-days"},{"count":70,"key":"181-730-days"},{"count":25,"key":"61-180-days"},{"count":134,"key":"over-730-days"}],"collection_id":"collection-v1-44afe7e58cd78b0a53ec18d6","duplicate_candidates_by_risk":[{"count":5,"key":"high"}],"missing_patch_head_base_by_class":[{"count":2,"key":"accessibility-testing"},{"count":16,"key":"browser-ui-testing"},{"count":3,"key":"build-tooling"},{"count":9,"key":"dev-feedback-review"},{"count":1,"key":"documentation-review"},{"count":1,"key":"failing-fragile-test-reproduction"},{"count":3,"key":"meaningful-good-first-bug"},{"count":6,"key":"php-runtime-compatibility"},{"count":29,"key":"recent-patch-verification"},{"count":52,"key":"stale-patch-refresh"},{"count":16,"key":"unit-test-review"}],"missing_reproducible_environments_by_class":[],"opportunity_count":289,"qualified_candidates_by_class":[{"count":2,"key":"accessibility-testing"},{"count":44,"key":"bounded-needs-patch"},{"count":38,"key":"browser-ui-testing"},{"count":6,"key":"build-tooling"},{"count":20,"key":"dev-feedback-review"},{"count":1,"key":"documentation-review"},{"count":1,"key":"failing-fragile-test-reproduction"},{"count":3,"key":"meaningful-good-first-bug"},{"count":44,"key":"needs-testing-verification"},{"count":2,"key":"performance-validation"},{"count":10,"key":"php-runtime-compatibility"},{"count":29,"key":"recent-patch-verification"},{"count":7,"key":"regression-test-only"},{"count":3,"key":"responsive-mobile-testing"},{"count":11,"key":"scoped-investigation"},{"count":52,"key":"stale-patch-refresh"},{"count":16,"key":"unit-test-review"}],"query_rows":{"accessibility_has_patch":0,"docs_needs_testing":0,"general_needs_testing":263,"good_first_bugs":0,"media_has_patch":26},"rejected_candidates_by_reason":[{"count":76,"key":"patch-refresh-required-before-verification"}],"schema":"supply-diagnostics.v1","screenshot_suitable_count":56,"snapshot_id":"snapshot-v1-dcdd905967a632c40ac065d8","stale_candidates_by_class":[{"count":39,"key":"bounded-needs-patch"},{"count":27,"key":"browser-ui-testing"},{"count":5,"key":"build-tooling"},{"count":11,"key":"dev-feedback-review"},{"count":1,"key":"failing-fragile-test-reproduction"},{"count":43,"key":"needs-testing-verification"},{"count":2,"key":"performance-validation"},{"count":7,"key":"php-runtime-compatibility"},{"count":6,"key":"regression-test-only"},{"count":3,"key":"responsive-mobile-testing"},{"count":10,"key":"scoped-investigation"},{"count":52,"key":"stale-patch-refresh"},{"count":11,"key":"unit-test-review"}],"version":1}
